{
  "$schema": "https://json-schema.org/draft/2020-12/schema",
  "$id": "https://agentoffernetwork.org/schema/offer-partner/v1.0",
  "title": "AgentOffer Partner Offer Schema v1.0",
  "description": "Stable v1.0 Partner supply and configuration artifact. It contains a Partner source identity plus Partner-authored public content, targeting, and conversion configuration; AON inventory identity, dispatch identity, and AON match reasoning are not part of this carrier.",
  "type": "object",
  "required": ["source_offer_id", "version", "offer_info", "entity", "action", "goals"],
  "properties": {
    "source_offer_id": {"type": "string", "minLength": 1, "maxLength": 256, "description": "Stable opaque Offer identity assigned by the Partner within the identity namespace configured for this integration. AON resolves owner, namespace, and this value to its own canonical offer_id before ranking or public projection."},
    "version": {"$ref": "https://agentoffernetwork.org/schema/offer/v1.0#/properties/version", "description": "Offer document-model lineage value 3.0; it does not select the transport protocol version."},
    "content_language": {"$ref": "https://agentoffernetwork.org/schema/offer/v1.0#/properties/content_language", "description": "Language of Partner-authored user-facing Offer copy under the stable-v1.0 language-tag profile; it is not an eligibility constraint."},
    "offer_info": {"allOf": [{"$ref": "https://agentoffernetwork.org/schema/offer/v1.0#/properties/offer_info"}, {"type": "object", "properties": {"commercial": {"type": "object", "description": "Partner-authored commercial source fields; the AON-derived display_price response projection is prohibited.", "not": {"required": ["display_price"]}}}, "not": {"required": ["min_age"]}}], "description": "Partner-authored user-facing title, description, taxonomy, commercial presentation, rating, and availability data. The AON-derived min_age projection is prohibited; declare audience age through targeting[].eligibility.min_age. Operational status, audit, priority, commission settlement, and private eligibility decisions are excluded."},
    "entity": {"$ref": "https://agentoffernetwork.org/schema/offer/v1.0#/properties/entity", "description": "Public identity of the merchant, brand, provider, publisher, or other party responsible for the Offer."},
    "listing_source": {"$ref": "https://agentoffernetwork.org/schema/offer/v1.0#/properties/listing_source", "description": "Optional provenance for the external platform or site where the Partner observed the user-facing listing information; it is distinct from entity and action."},
    "action": {"$ref": "https://agentoffernetwork.org/schema/offer/v1.0#/properties/action", "description": "Safe executable destination and user-facing action copy supplied for the Offer."},
    "material": {"$ref": "https://agentoffernetwork.org/schema/offer/v1.0#/properties/material", "description": "Optional non-empty list of HTTPS creative resources and their presentation metadata."},
    "targeting": {"type": "array", "minItems": 1, "maxItems": 10, "items": {"$ref": "#/$defs/targeting"}, "description": "Optional Partner-only eligibility rules. Declared dimensions within one rule are ANDed, rules are ORed, exclusions win, and unknown context fails the affected declared dimension closed. The field is never serialized in a public Offer."},
    "conversion_rule": {"$ref": "#/$defs/conversionRule", "description": "Optional Partner-only attribution and qualification configuration. Omitted members use the stable-v1.0 defaults defined by the Protocol; the field is never serialized in a public Offer."},
    "claims": {"$ref": "https://agentoffernetwork.org/schema/offer/v1.0#/properties/claims", "description": "Optional non-empty list of bounded Partner- or source-provided statements. They remain source claims and are not AON endorsements."},
    "goals": {"$ref": "https://agentoffernetwork.org/schema/offer/v1.0#/properties/goals", "description": "Unique billable conversion events and the gross Partner-to-AON commission basis declared for each event."}
  },
  "additionalProperties": false,
  "$defs": {
    "targeting": {
      "type": "object",
      "minProperties": 1,
      "description": "One Partner-only eligibility rule. Declared dimensions are evaluated together with AND; an unknown value for a declared dimension makes this rule fail, while omitted dimensions are unconstrained.",
      "properties": {
        "geo": {"type": "object", "minProperties": 1, "description": "Optional geographic inclusion and exclusion constraints. A location matches itself or a descendant in the AON Location Registry; exclusion takes precedence over inclusion.", "properties": {"include": {"type": "array", "minItems": 1, "uniqueItems": true, "items": {"$ref": "#/$defs/location"}, "description": "Non-empty locations in which this rule can be eligible. When omitted, geography is not positively restricted by an include list."}, "exclude": {"type": "array", "minItems": 1, "uniqueItems": true, "items": {"$ref": "#/$defs/location"}, "description": "Non-empty locations made ineligible by this rule. A matching exclusion overrides a matching inclusion."}}, "additionalProperties": false},
        "eligibility": {"type": "object", "minProperties": 1, "description": "Optional Partner-side eligibility constraints. Each constraint is evaluated only against verified viewer context the request supplies; without that context it does not restrict the rule.", "properties": {"min_age": {"type": "integer", "minimum": 1, "maximum": 120, "description": "Minimum verified user age for this rule. The rule fails only when the request supplies a verified age below this value; a request without a verified age is not age-restricted. Because Query verified_age_over is at least 13, values from 1 through 13 never fail age evaluation and act only as audience declarations."}}, "additionalProperties": false},
        "language": {"type": "string", "pattern": "^[a-z]{2}$", "description": "Optional two-letter lowercase ASCII primary-language eligibility constraint. This profile validates syntax, not ISO 639 registry membership, and is distinct from content_language, which describes Offer copy."},
        "device_type": {"type": "array", "minItems": 1, "uniqueItems": true, "items": {"type": "string", "enum": ["mobile", "desktop", "tablet", "smart_tv"]}, "description": "Optional non-empty eligible device classes. Missing or unknown device context does not satisfy this declared constraint."},
        "os": {"type": "array", "minItems": 1, "uniqueItems": true, "items": {"type": "string", "enum": ["ios", "android", "windows", "macos"]}, "description": "Optional non-empty eligible operating systems. Missing or unknown operating-system context does not satisfy this declared constraint."}
      },
      "additionalProperties": false
    },
    "location": {"type": "object", "description": "Reference to an AON Location Registry v1 entry for Partner eligibility. Numeric grammar is checked structurally and registry membership is checked by the stable-v1.0 semantic validator.", "required": ["location_id"], "properties": {"location_id": {"type": "string", "pattern": "^[0-9]+$", "description": "Numeric identifier that must exist in the pinned AON Location Registry v1 snapshot."}}, "additionalProperties": false},
    "conversionRule": {"type": "object", "minProperties": 1, "description": "Partner-only conversion attribution and qualification configuration. Window endpoints are inclusive; zero disables that attribution source. Defaults are click_window_hours=720, view_window_hours=0, attribution_model=last_click, and dedup_strategy=first.", "properties": {"click_window_hours": {"type": "integer", "minimum": 0, "maximum": 8760, "description": "Hours after a qualifying click during which a conversion timestamp is eligible, inclusive of both endpoints. Zero disables click attribution; omission defaults to 720."}, "view_window_hours": {"type": "integer", "minimum": 0, "maximum": 8760, "description": "Hours after a qualifying view during which a conversion timestamp is eligible, inclusive of both endpoints. Zero disables view-through attribution and is the default."}, "attribution_model": {"type": "string", "enum": ["last_click", "first_click"], "description": "Selects the latest or earliest eligible click; a qualifying click takes precedence over a view, and the same ordering applies to views only when no click qualifies. Omission defaults to last_click."}, "dedup_strategy": {"type": "string", "enum": ["first", "all"], "description": "Controls distinct business conversions for the same Partner, Offer, Goal, and conversion identity: first accepts only the first qualifying identity, while all accepts every distinct identity. Retries of one identity never count twice. Omission defaults to first."}, "minimum_amount": {"type": "string", "pattern": "^(?:0|[1-9][0-9]{0,11})(?:\\.[0-9]{1,6})?$", "not": {"enum": ["0", "0.0", "0.00", "0.000", "0.0000", "0.00000", "0.000000"]}, "description": "Optional strictly positive gross conversion-amount threshold. It is valid only for a single-currency integration and is interpreted in that integration's fixed reported conversion currency; multi-currency integrations keep currency-qualified thresholds outside this field."}}, "additionalProperties": false}
  }
}
