{
  "source_offer_id": "partner-hotel-001",
  "version": "3.0",
  "content_language": "en-US",
  "offer_info": {"title": "Quiet hotel", "short_description": "Quiet, walkable hotel near Union Square.", "category": {"id": "travel_tourism.accommodations.hotels_motels_resorts.hotels"}, "description": "A quiet hotel with walkable access to Union Square.", "commercial": {"price": {"amount": "199.00", "currency": "USD", "unit": "night"}}},
  "entity": {"id": "example-hotels", "name": "Example Hotels", "type": "merchant", "logo": "https://cdn.example.com/example-hotels.svg"},
  "listing_source": {"kind": "marketplace", "name": "Example Travel", "observed_at": "2026-08-13T00:00:00Z", "logo": "https://cdn.example.com/example-travel.svg"},
  "action": {"type": "open_url", "consumer_action": "book", "payload": {"url": "https://example.com/hotel"}},
  "targeting": [{"geo": {"include": [{"location_id": "1014221"}]}, "eligibility": {"min_age": 18}, "language": "en"}],
  "conversion_rule": {"click_window_hours": 72, "attribution_model": "last_click", "minimum_amount": "10.00"},
  "goals": [{"event": "booking", "pricing": {"model": "cpa", "amount": "10", "currency": "USD"}}]
}
